{"$schema":"https://json-schema.org/draft/2020-12/schema","$id":"https://github.com/rezahh107/PR-Inspector/protocols/v1.13.1/schemas/functional-runtime-contract.schema.json","type":"object","additionalProperties":false,"required":["$schema","schema_version","protocol","references","model_bootstrap","pipeline_stages","field_authority","rule_defaults","functional_rules","required_artifacts","required_check_names","diagnostics"],"properties":{"$schema":{"type":"string"},"schema_version":{"const":2},"protocol":{"type":"object","additionalProperties":false,"required":["version","inspector_repository","inspector_repository_id","profile","authority"],"properties":{"version":{"const":"v1.13.1"},"inspector_repository":{"const":"rezahh107/PR-Inspector"},"inspector_repository_id":{"const":1288323264},"profile":{"type":"string","minLength":1},"authority":{"const":"functional_contract_ssot"}}},"references":{"type":"object","additionalProperties":{"type":"string","pattern":"^protocols/v1\\.13\\.1/.+"},"minProperties":15,"maxProperties":15,"propertyNames":{"type":"string","minLength":1}},"model_bootstrap":{"type":"object","additionalProperties":false,"required":["instructions","assessment_obligations"],"properties":{"instructions":{"type":"array","minItems":1,"items":{"type":"string","minLength":1}},"assessment_obligations":{"type":"array","minItems":1,"items":{"type":"string","minLength":1}}}},"pipeline_stages":{"type":"array","minItems":8,"items":{"type":"object","additionalProperties":false,"required":["stage_id","owner","function"],"properties":{"stage_id":{"type":"string","minLength":1},"owner":{"type":"string","minLength":1},"function":{"type":"string","pattern":"^[^:#]+\\.py:[A-Za-z_][A-Za-z0-9_]*$"}}},"contains":{"type":"object","properties":{"stage_id":{"const":"canonical_assembly"}},"required":["stage_id"]}},"field_authority":{"type":"array","minItems":4,"items":{"type":"object","additionalProperties":false,"required":["surface","owner"],"properties":{"surface":{"type":"string","minLength":1},"owner":{"type":"string","minLength":1}}}},"rule_defaults":{"type":"object","additionalProperties":false,"required":["validator","positive_control","negative_prefix","ci_commands","recovery_action"],"properties":{"validator":{"type":"string","pattern":"^[^:#]+\\.py:[A-Za-z_][A-Za-z0-9_]*$"},"positive_control":{"type":"string","minLength":1},"negative_prefix":{"type":"string","minLength":1},"ci_commands":{"type":"object","additionalProperties":false,"required":["F","E","A"],"properties":{"F":{"type":"string","minLength":1},"E":{"type":"string","minLength":1},"A":{"type":"string","minLength":1}}},"recovery_action":{"type":"string","minLength":1}}},"functional_rules":{"type":"array","minItems":43,"maxItems":43,"items":{"type":"array","minItems":4,"maxItems":4,"prefixItems":[{"type":"string","pattern":"^PRR-[A-Z0-9-]+-001$"},{"enum":["Critical","High","Medium","Low"]},{"type":"string","pattern":"^[a-z0-9_]+$"},{"enum":["F","E","A"]}]}},"required_artifacts":{"type":"array","minItems":1,"uniqueItems":true,"items":{"type":"string","minLength":1}},"required_check_names":{"type":"array","uniqueItems":true,"items":{"type":"string","minLength":1}},"diagnostics":{"type":"object","additionalProperties":false,"required":["prefix","recovery_actions"],"properties":{"prefix":{"type":"string","minLength":1},"recovery_actions":{"type":"array","minItems":1,"uniqueItems":true,"items":{"type":"string","minLength":1}}}}}}
