{"$schema":"./schemas/functional-runtime-contract.schema.json","diagnostics":{"prefix":"PRI-FUNCTIONAL-BOOTSTRAP","recovery_actions":["block","repair","rerun"]},"field_authority":[{"surface":"intent","owner":"caller"},{"surface":"facts","owner":"verified target"},{"surface":"judgment","owner":"reviewer"},{"surface":"projection","owner":"runtime"}],"functional_rules":[["PRR-OWNER-MERGE-001","Critical","owner_merge_with_pending_approval","F"],["PRR-OWNER-TWO-LINE-001","Critical","owner_result_third_line","F"],["PRR-OWNER-PROMPT-ATOMIC-001","Critical","compact_owner_result_with_required_prompt","F"],["PRR-DECISION-SOURCE-001","Critical","projection_action_drift","F"],["PRR-REASON-REGISTRY-001","Critical","unregistered_reason_code","F"],["PRR-VERIFY-NOMODIFY-001","Critical","verify_repair_authority","F"],["PRR-STALE-NOREPAIR-001","Critical","stale_routes_to_repair","F"],["PRR-RECIPIENT-BOUNDARY-001","Critical","specialist_routes_to_implementer","F"],["PRR-MANIFEST-BYTES-001","Critical","artifact_byte_changed","F"],["PRR-CI-IDENTITY-001","Critical","synthetic_merge_claimed_exact","F"],["PRR-EXACT-HEAD-CLAIM-001","Critical","merge_sha_substituted_for_head","F"],["PRR-PENDING-REREVIEW-001","Critical","accept_without_verified_rereview","F"],["PRR-PROMPT-INJECTION-001","Critical","prompt_section_injection","F"],["PRR-COV-AUTHORITY-001","Critical","coverage_authority_mismatch","E"],["PRR-COV-WORKFLOW-001","Critical","coverage_workflow_duplicate_key","E"],["PRR-COV-SUPPLY-001","Critical","coverage_supply_chain_mutable_action","E"],["PRR-COV-PLANNING-001","Critical","coverage_planning_malformed_json","E"],["PRR-COV-INTEGRATION-001","High","coverage_integration_unresolved_issuer","E"],["PRR-GOV-PERSONAL-PROFILE-001","High","profile_minimum_enforcement_absent","F"],["PRR-GOV-PROFILE-TRIGGER-001","High","profile_trigger_without_verified_enforcement","F"],["PRR-GOV-CLAIM-SEPARATION-001","High","profile_self_asserted_stronger_claims","F"],["PRR-GOV-PROJECTION-AUTHORITY-001","High","profile_manual_projection_override","F"],["PRR-PROMPT-SEMANTIC-001","Critical","generic_prompt_semantically_incomplete","F"],["PRR-OUTPUT-AUTHORITY-001","Critical","candidate_output_authority_exposed","F"],["PRR-AUTH-PACKAGE-BOUNDARY-001","Critical","raw_or_lookalike_package_reaches_completion","A"],["PRR-AUTH-EVIDENCE-COMPLETENESS-001","Critical","caller_injected_source_or_partial_enumeration_accepted","A"],["PRR-AUTH-CLAIM-COMPATIBILITY-001","Critical","unsupported_claim_authority_escalation","A"],["PRR-AUTH-DERIVED-FACTS-001","Critical","caller_selected_derived_fact","A"],["PRR-AUTH-HUMAN-JUDGMENT-001","High","manual_judgment_promoted_or_rejected","A"],["PRR-AUTH-PREVIEW-ISOLATION-001","Critical","preview_promoted_to_official","A"],["PRR-AUTH-REVERIFY-BOUNDARY-001","Critical","persisted_bundle_or_forged_completion_reverified","A"],["PRR-AUTH-EXTERNAL-RECONCILIATION-001","Critical","uninspected_external_source_produces_green","A"],["PRR-DOC-LIFECYCLE-001","High","stale_unmerged_candidate_wording","F"],["PRR-GOV-CLAIM-001","Critical","missing_settings_evidence","F"],["PRR-GOV-PAYLOAD-PROVENANCE-001","Critical","fabricated_record_with_canonical_urls","F"],["PRR-GOV-REVIEW-001","Critical","bot_author_or_stale_review","F"],["PRR-GOV-CHECK-PRODUCER-001","Critical","same_name_check_wrong_app","F"],["PRR-GOV-SPECIALIST-001","High","specialist_boolean_without_membership","F"],["PRR-GOV-FRESHNESS-001","Critical","stale_or_replayed_api_receipt","F"],["PRR-GOV-AUTHORIZATION-001","Critical","missing_governance_capability","F"],["PRR-GOV-CLI-001","Critical","merge_authorized_cli_without_governance","F"],["PRR-GOV-BYPASS-001","Critical","unknown_or_present_bypass_actor","F"],["PRR-HISTORY-NOFABRICATION-001","High","fabricated_pr12_approval","F"]],"model_bootstrap":{"instructions":["load local SSOT","preserve target evidence"],"assessment_obligations":["fail closed"]},"pipeline_stages":[{"function":"pr_inspector/verified_review.py:ReviewRequest","owner":"caller_intent","stage_id":"intake"},{"function":"pr_inspector/official_review.py:collect_review_facts","owner":"verified_target_source","stage_id":"evidence_collection"},{"function":"pr_inspector/verified_review.py:parse_review_assessment","owner":"reviewer_judgment","stage_id":"assessment"},{"function":"pr_inspector/functional_review.py:assemble_review_package","owner":"deterministic_runtime","stage_id":"canonical_assembly"},{"function":"pr_inspector/validation_v2.py:validate_package","owner":"deterministic_runtime","stage_id":"package_validation"},{"function":"pr_inspector/decision_projection.py:project_decision","owner":"deterministic_runtime","stage_id":"decision_projection"},{"function":"pr_inspector/official_review.py:complete_review","owner":"deterministic_runtime","stage_id":"official_completion"},{"function":"pr_inspector/owner_delivery.py:official_owner_delivery","owner":"deterministic_runtime","stage_id":"owner_delivery"}],"protocol":{"authority":"functional_contract_ssot","inspector_repository":"rezahh107/PR-Inspector","inspector_repository_id":1288323264,"profile":"personal_single_operator","version":"v1.13.1"},"references":{"ci_identity_schema":"protocols/v1.13.1/schemas/ci-identity.schema.json","coverage_view":"protocols/v1.13.1/policies/BEHAVIORAL_RULE_COVERAGE.md","decision_projection_schema":"protocols/v1.13.1/schemas/decision-projection.schema.json","governance_coverage_view":"protocols/v1.13.1/policies/GOVERNANCE_BEHAVIORAL_RULE_COVERAGE.md","governance_evidence_schema":"protocols/v1.13.1/schemas/governance-evidence.schema.json","intake_response":"protocols/v1.13.1/prompts/INTAKE_RESPONSE.fa.md","owner_decision_template":"protocols/v1.13.1/templates/OWNER_DECISION_CARD.fa.md","owner_delivery_contract":"protocols/v1.13.1/policies/OWNER_DELIVERY_CONTRACT.json","owner_delivery_schema":"protocols/v1.13.1/schemas/owner-delivery-contract.schema.json","pipeline_view":"protocols/v1.13.1/pipeline/REVIEW_PIPELINE.md","reason_registry":"protocols/v1.13.1/registries/DECISION_REASON_REGISTRY.yaml","rereview_sequence_schema":"protocols/v1.13.1/schemas/rereview-sequence.schema.json","review_assessment_schema":"protocols/v1.13.1/schemas/review-assessment.schema.json","review_package_schema":"protocols/v1.13.1/schemas/review-package.schema.json","technical_handoff_template":"protocols/v1.13.1/templates/TECHNICAL_HANDOFF.en.md"},"required_artifacts":["review-package.json","DECISION_PROJECTION.json","OWNER_RESULT.fa.txt","TECHNICAL_HANDOFF.en.md","OWNER_PROFILE_COMMANDS.fa.txt","artifact-manifest.json"],"required_check_names":[],"schema_version":2,"rule_defaults":{"validator":"scripts/validate_repository.py:main","positive_control":"scripts/validate_repository.py:main","negative_prefix":"README.md#","ci_commands":{"F":"python -m pytest -q tests/test_behavioral_rule_coverage.py tests/test_governance_enforcement.py","E":"python -m pytest -q tests/test_coverage_trust_gate.py","A":"python -m pytest -q tests/test_v1_13_verified_review_authority.py tests/test_v1_13_evidence_completeness.py"},"recovery_action":"block"}}
